{
  "schemaVersion": "matching-agent-review@1",
  "taskId": "matching-agent-year-seventeen-regression-20261004",
  "packageId": "year-seventeen@9",
  "reviewSummary": "General matching is complete. The manifest reports 150 claims, 1,750 candidate cards, 115 task proposals, and 0 uncovered claims. Route counts are broll: 5, scenes: 115, and template_review: 110. There are 127 typed gaps: 76 production_ready_media_handoff_missing and 51 typed_data_handoff_missing.",
  "warnings": [
    "5 tasks have no candidates.",
    "The first blocking stage is render_release_handoff."
  ],
  "typedGaps": [],
  "selectionAuthorized": false,
  "renderingAuthorized": false
}